{
  "schema_version": "agent2host/v1alpha1",
  "kind": "Agent",
  "id": "demo",
  "sop": "./sops/demo.sop.md",
  "permissions": {
    "filesystem": {
      "read": [
        "working_directory"
      ],
      "write": [
        "working_directory"
      ]
    },
    "network": {
      "default": "deny"
    }
  }
}
