{
  "schema_version": "agent2host/v1alpha1",
  "kind": "Agent",
  "id": "demo",
  "sop": "./sops/demo.sop.md",
  "mcp_servers": {
    "example-mcp": {
      "transport": "stdio",
      "command": "python",
      "args": [
        "./mcp/example-mcp.py"
      ],
      "files": [
        "./mcp/example-mcp.py"
      ],
      "tools": [
        "search_policy"
      ],
      "environment": [
        {
          "value_from": {
            "environment": "A2H_TEST_TOKEN"
          },
          "required": true
        }
      ]
    }
  }
}
